{
	"$schema": "http://json-schema.org/draft-07/schema#",
	"title": "Jhara Ecosystem Signature",
	"description": "Schema for community-contributed ecosystem signatures. Place JSON files matching this schema in ~/Library/Application Support/com.hmyousuf.jhara.app/signatures/ to add detection for tools not included in the built-in database.",
	"type": "array",
	"items": {
		"type": "object",
		"required": ["filename", "ecosystem", "artifact_paths"],
		"properties": {
			"filename": {
				"type": "string",
				"description": "The filename to detect at the project root. Use '*.ext' for wildcard suffix matching (e.g., '*.tf' matches any .tf file).",
				"examples": ["package.json", "Cargo.toml", "*.tf", "build.gradle"]
			},
			"ecosystem": {
				"type": "string",
				"description": "Identifier for the ecosystem. Use snake_case. This becomes the label in the UI.",
				"examples": ["node_js", "rust", "go", "python_pip"]
			},
			"artifact_paths": {
				"type": "array",
				"description": "The directories to clean when this project type is detected.",
				"items": {
					"type": "object",
					"required": ["relative_path", "safety_tier"],
					"properties": {
						"relative_path": {
							"type": "string",
							"description": "Path relative to the project root (or relative to $HOME if is_global is true).",
							"examples": ["node_modules", "target", ".venv", ".gradle/caches"]
						},
						"safety_tier": {
							"type": "string",
							"enum": ["safe", "caution", "risky", "blocked"],
							"description": "How safely this artifact can be deleted. Use 'safe' for anything automatically regenerated by the build tool. Use 'caution' for expensive-to-rebuild or historically-valuable artifacts. Use 'risky' for live infrastructure state. Use 'blocked' for things that must NEVER be deleted (credentials, state files)."
						},
						"is_global": {
							"type": "boolean",
							"default": false,
							"description": "Set to true for global caches in the user's home directory rather than inside a project root."
						},
						"recovery_command": {
							"type": "string",
							"description": "The command a developer would run to regenerate this artifact after deletion. Shown in the confirmation UI.",
							"examples": [
								"npm install",
								"cargo build",
								"pip install -r requirements.txt"
							]
						},
						"typical_size_mb_min": {
							"type": "integer",
							"description": "Typical minimum size of this artifact in megabytes.",
							"minimum": 0
						},
						"typical_size_mb_max": {
							"type": "integer",
							"description": "Typical maximum size of this artifact in megabytes.",
							"minimum": 0
						}
					}
				}
			},
			"content_key": {
				"type": "string",
				"description": "Optional string that must appear in the detected file's content to confirm the match. Useful for disambiguating files that share a name across ecosystems (e.g., a generic build.gradle vs a Kotlin build.gradle.kts).",
				"examples": ["django", "react-native", "flutter:"]
			},
			"priority": {
				"type": "integer",
				"default": 0,
				"description": "Priority for disambiguation when multiple signatures match the same directory. Higher priority wins. The built-in database uses 0 for base signatures and 10+ for more specific ones.",
				"minimum": 0
			},
			"stale_threshold_days": {
				"type": "integer",
				"default": 60,
				"description": "Number of days of inactivity before this project is considered stale and eligible for automated cleanup.",
				"minimum": 1
			}
		}
	},
	"examples": [
		{
			"filename": "gleam.toml",
			"ecosystem": "gleam",
			"artifact_paths": [
				{
					"relative_path": "build",
					"safety_tier": "safe",
					"recovery_command": "gleam build",
					"typical_size_mb_min": 10,
					"typical_size_mb_max": 500
				}
			],
			"stale_threshold_days": 30
		}
	]
}
